ID,Year,Title,Conference,Authors,Abstract,DOI,Thumbtail,Keywords,,,
274,2019,When is it not Craft?: Materiality and Mediation when Craft and Computing Meet,ACM TEI,"Michael Nitsche, Anna Weisling","Craft has emerged as an important reference point for HCI. To avoid a misrepresenting, all-encompassing application of craft to interaction design, this position paper first discerns craft from HCI. It develops material engagement and mediation as differentiating factors to reposition craft in relation to tangible interaction design. The aim is to clarify craft's relation to interaction design and to open up new opportunities and questions that follow from this repositioning.",https://doi.org/10.1145/3294109.3295651,https://hcie.csail.mit.edu/fabpub/img/not-craft.png,Craft; Tangible Interaction Design; Design Research; Physical Computing,,,
1,2018,ColorMod: Recoloring 3D Printed Objects using Photochromic Inks,ACM CHI,"Parinya Punpongsanon, Xin Wen, David S Kim, Stefanie Mueller","Recent research has shown how to change the color of existing objects using photochromic materials. These materials can switch their appearance from transparent to colored when exposed to light of a certain wavelength. The color remains even when the object is removed from the light source. The process is fully reversible allowing users to recolor the object as many times as they want. In this paper, we present ColorFab, a method to extend this approach to multi-color changes (e.g., red-to-yellow)	[...]",https://doi.org/10.1145/3173574.3173787,http://hcie.csail.mit.edu/fabpub/img/colormod.jpg,Personal Fabrication; 3D Printing; Projector-Camera System,,,
2,2018,RoMA: Interactive Fabrication with Augmented Reality and a Robotic 3D Printer,ACM CHI,"Huaishu Peng, Jimmy Briggs, Cheng-Yao Wang, Kevin Guo, Joseph Kider, Stefanie Mueller, Patrick Baudisch, François Guimbretière","We present the Robotic Modeling Assistant (RoMA), an interactive fabrication system providing a fast, precise, hands-on and in-situ modeling experience. As a designer creates a new model using RoMA AR CAD editor, features are constructed concurrently by a 3D printing robotic arm sharing the same design volume. The partially printed physical model then serves as a tangible reference for the designer as she adds new elements to her design. RoMA's proxemics-inspired handshake mechanism between the designer and   	[...]",https://doi.org/10.1145/3173574.3174153,http://hcie.csail.mit.edu/fabpub/img/roma.jpg,3D Printing; Augmented Reality; Interactive Fabrication; CAD; Rapid Prototyping; Physical Prototyping,,,
3,2018,Digital Joinery For Hybrid Carpentry,ACM CHI,"Shiran Magrisso, Moran Mizrahi, Amit Zoran","The craft of carpentry relies on joinery: the connections between pieces of wood to create multipart structures. In traditional woodworking, joints are limited to the manual chisel skills of the craftsperson, or to capabilities of the machines, which favorite 90лЌ or 180лЌ angle joints with no more than two elements. We contribute an interactive design process in which joints are  	[...]",https://doi.org/10.1145/3173574.3174015,http://hcie.csail.mit.edu/fabpub/img/digital_joinery.PNG,3D Sculpting; Papercraft; Paper Electronics; Fabrication Techniques; Prototyping,,,
4,2018,PEP (3D Printed Electronic Papercrafts): An Integrated Approach for 3D Sculpting Paper-Based Electronic Devices,ACM CHI,"Hyunjoo Oh, Tung D. Ta, Ryo Suzuki, Mark D. Gross, Yoshihiro Kawahara, Lining Yao","We present PEP (Printed Electronic Papercrafts), a set of design and fabrication techniques to integrate electronic based interactivities into printed papercrafts via 3D sculpting. We explore the design space of PEP, integrating four functions into 3D paper products: actuation, sensing, display, and communication, leveraging the expressive and technical opportunities enabled by  	[...]",https://dl.acm.org/citation.cfm?doid=3173574.3173741,http://hcie.csail.mit.edu/fabpub/img/pep.jpg,Design; Carpentry; Woodwork; Joinery; 3D Printing; Hybrid; Digital Fabrication; CAD,,,
5,2018,MatchSticks: Woodworking through Improvisational Digital Fabrication,ACM CHI,"Rundong Tian, Sarah Sterman, Ethan Chiou, Jeremy Warner, Eric Paulos","Digital fabrication tools have broadened participation in making and enabled new methods of rapid physical prototyping across diverse materials. We present a novel smart tool designed to complement one of the first materials employed by humans - wood - and celebrate the fabrication practice of joinery. Our tool, MatchSticks, is a digital fabrication system tailored for joinery. Combining a portable CNC machine, touchscreen user interface, and parametric joint library, MatchSticks enables	[...]",https://doi.org/10.1145/3173574.3173723,http://hcie.csail.mit.edu/fabpub/img/matchsticks.PNG,Fabrication; Prototyping; Woodwork,,,
6,2018,RFIBricks: Interactive Building Blocks Based on RFID,ACM CHI,"Meng-Ju Hsieh, Rong-Hao Liang, Da-Yuan Huang, Jheng-You Ke, Bing-Yu Chen","We present RFIBricks, an interactive building block system based on ultrahigh frequency radio-frequency identification (RFID) sensing. The system enables geometry resolution based on a simple yet highly generalizable mechanism: an RFID contact switch, which is made by cutting each RFID tag into two parts, namely antenna and chip. A magnetic connector is then coupled with each part. When the antenna and chip connect, an interaction event with an ID is transmitted to the reader. On the basis of our design of RFID contact switch patterns	[...]",https://doi.org/10.1145/3173574.3173763,http://hcie.csail.mit.edu/fabpub/img/rfid.jpg,RFID; Tangible User Interface; Building Blocks; Constructive Assembly,,,
7,2018,PHUI-kit: Interface Layout and Fabrication on Curved 3D Printed Objects,ACM CHI,"Michael D Jones, Zann Anderson, Casey Walker, Kevin Seppi","We seek to make physical user interface (PHUI) design more like graphical user interface (GUI) design by using a drag-and drop interface to place widgets, allowing widgets to be repositioned and by hiding implementation details. PHUIs are interfaces built from tangible widgets arranged on the surfaces of physical objects. PHUI layout will become more important as we move from rectangular screens  	[...]",https://doi.org/10.1145/3173574.3173684,http://hcie.csail.mit.edu/fabpub/img/phui-kit.jpg,User Interface Layout; Fabrication; Maker Culture; Internet of Things,,,
8,2018,Double-sided Printed Tactile Display with Electro Stimuli and Electrostatic Forces and its Assessment,ACM CHI,"Kunihiro Kato, Hiroki Ishizuka, Hiroyuki Kajimoto, Homei Miyashita","Humans can perceive tactile sensation through multimodal stimuli. To demonstrate realistic pseudo tactile sensation for the users, a tactile display is needed that can provide multiple tactile stimuli. In this paper, we have explicated a novel printed tactile display that can provide both the electrical stimulus and the electrostatic force. The circuit patterns for each stimulus were fabricated by employing the technique of 	[...]",https://doi.org/10.1145/3173574.3174024,http://hcie.csail.mit.edu/fabpub/img/doubleprintedtactile.jpg,Tactile Display; Double-Sided Printing; Conductive Ink; Multiple Stimuli; Electrical Stimulus; Electrostatic Force,,,
9,2018,Sketch&Stitch;: Interactive Embroidery for E-textiles,ACM CHI,"Nur Al-huda Hamdan, Simon Voelker, Jan Borchers","E-Textiles are fabrics that integrate electronic circuits and components. Makers use them to create interactive clothing, furniture, and toys. However, this requires significant manual labor and skills, and using technology-centric design tools. We introduce Sketch&Stitch;, an interactive embroidery system to create e-textiles using a traditional crafting approach: Users draw their art and circuit directly on fabric using  	[...]",https://doi.org/10.1145/3173574.3173656,http://hcie.csail.mit.edu/fabpub/img/sketchstitch.jpg,E-textile; Embroidery; Interactive Fabrication; Physical Sketching,,,
10,2018,Grafter: Remixing 3D-Printed Machines,ACM CHI,"Thijs Jan Roumen, Willi Müller, Patrick Baudisch","Creating new 3D printed objects by recombining models found in hobbyist repositories has been referred to as _СТre-mixing_Сќ. In this paper, we explore how to best support users in remixing a specific class of 3D printed objects, namely those that perform mechanical functions. Grafter does two things. First, grafter largely automates the process of extracting and recombining mechanical elements from 3D printed machines. Second, it enforces a more efficient approach to reuse: it prevents users from extracting   	[...]",https://doi.org/10.1145/3173574.3173637,http://hcie.csail.mit.edu/fabpub/img/3dgrafter.jpg,Fabrication; 3D Printing; Remixing,,,
11,2018,Thermorph: Democratizing 4D Printing of Self-Folding Materials and Interfaces,ACM CHI,"Byoungkwon An, Ye Tao, Jianzhe Gu, Tingyu Cheng, Xiang 'Anthony' Chen, Xiaoxiao Zhang, Wei Zhao, Youngwook Do, Shigeo Takahashi, Hsiang-Yun Wu, Teng Zhang, Lining Yao","We develop a novel method printing complex self-folding geometries. We demonstrated that with a desktop fused deposition modeling (FDM) 3D printer, off-the-shelf printing filaments and a design editor, we can print flat thermoplastic composites and trigger them to self-fold into 3D with arbitrary bending angles. This is a suitable technique, called Thermorph, to prototype hollow and 	[...]",https://doi.org/10.1145/3173574.3173834,http://hcie.csail.mit.edu/fabpub/img/thermorph.png,3D Printing; 4D Printing; Shape Memory Polymer; Thermoplastic; Self-Folding; Shape Changing; Computational Geometry; Computational Fabrication.,,,
12,2018,Metamaterial Textures,ACM CHI,"Alexandra Ion, Robert Kovacs, Oliver S. Schneider, Pedro Lopes, Patrick Baudisch","We present metamaterial textures---3D printed surface geometries that can perform a controlled transition between two or more textures. Metamaterial textures are integrated into 3D printed objects and allow designing how the object interacts with the environment and the user_Сйs tactile sense. Inspired by foldable paper sheets (_СТorigami_Сќ) and surface wrinkling, our 3D printed metamaterial textures consist of a grid of cells that fold when compressed  	[...]",https://doi.org/10.1145/3173574.3173910,http://hcie.csail.mit.edu/fabpub/img/metamaterials.jpg,Metamaterials; Textures; Fabrication; 3D Printing; Programmable Matter,,,
13,2018,Silicone Devices: A Scalable DIY Approach for Fabricating Self-Contained Multi-Layered Soft Circuits using Microfluidics,ACM CHI,"Steven Nagels, Raf Ramakers, Kris Luyten, Wim Deferme","We present a scalable Do-It-Yourself (DIY) fabrication workflow for prototyping highly stretchable yet robust devices using a CO2 laser cutter, which we call Silicone Devices. Silicone Devices are self-contained and thus embed components for input, output, processing, and power. Our approach scales to arbitrary complex devices as it supports techniques to make multi-layered stretchable circuits and buried VIAs. Additionally, high-frequency  	[...]",https://doi.org/10.1145/3173574.3173762,http://hcie.csail.mit.edu/fabpub/img/siliconeDIY.jpg,Fabrication; Stretchable Circuits; Flexible Circuits; DIY; Ubiquitous Computing; Wearable Computing,,,
14,2018,Mechanism Perfboard: An Augmented Reality Environment for Linkage Mechanism Design and Fabrication,ACM CHI,"Yunwoo Jeong, Han-Jong Kim, Tek-Jin Nam","Prototyping devices with kinetic mechanisms, such as automata and robots, has become common in physical computing projects. However, mechanism design in the early-concept exploration phase is challenging, due to the dynamic and unpredictable characteristics of mechanisms. We present Mechanism Perfboard, an augmented reality environment that supports linkage   	[...]",https://doi.org/10.1145/3173574.3173985,http://hcie.csail.mit.edu/fabpub/img/perfboard.jpg,Linkage Mechanism; Prototyping; Fabrication; Augmented Reality; Computational Design,,,
15,2018,Greater than the Sum of its PARTs: ExpressIng and ReusIng design intent In 3D models,ACM CHI,"Megan K Hofmann, Gabriella Han, Scott E Hudson, Jennifer Mankoff","With the IncreasIng popularity of conSumer-grade 3D prIntIng, many people are creatIng, and even more usIng, objects shared on sites such as ThIngiverse. However, our formative study of 962 ThIngiverse models shows a lack of re-use of models, perhaps due to the advanced skills needed for 3D modelIng. An end user program perspective on 3D modelIng is needed. Our framework (PARTs) empowers amateur modelers to graphically specify design intent through geometry. PARTs Includes a GUI, scriptIng API  	[...]",https://doi.org/10.1145/3173574.3173875,http://hcie.csail.mit.edu/fabpub/img/greaterthansum.jpg,Fabrication; Prototyping; 3D Printing,,,
16,2018,Medley: A library of embeddables to explore Rich material properties for 3D printed objects,ACM CHI,"Xiang Chen, Stelian Coros, Scott E Hudson","In our everyday life, we interact with and benefit from objects with a wide range of material properties. In contrast, personal fabrication machines (e.g., desktop 3D printers) currently only support a much smaller set of materials. Our goal is to close the gap between current limitations and the future of multi-material printing by enabling people to explore the reuse of material from 	[...]",https://doi.org/10.1145/3173574.3173736,http://hcie.csail.mit.edu/fabpub/img/medley.PNG,Embeddables; Multi-Material Printing; Fabrication,,,
17,2018,Digital Konditorei: programmable taste structures using a modular mold,ACM CHI,"Amit Zoran, Dror Cohen","Digital Gastronomy (DG) is a culinary concept that enhances traditional cooking with new HCI capabilities, rather than replacing the chef with an autonomous machine. Preliminary projects demonstrate implementation of DG via the deployment of Digital instruments in a kitchen. Here we contribute an alternative solution, demonstrating the use of a modular (silicone) mold and a genetic mold-arrangement	[...]",https://doi.org/10.1145/3173574.3173974,http://hcie.csail.mit.edu/fabpub/img/konditorei.PNG,Food; Kitchen; Cooking; Dessert; Mold; Design; Fabrication,,,
18,2018,off-line sensing: Memorizing interactions in passive 3D-printed objects,ACM CHI,"Martin Schmitz, Martin Herbers, Niloofar Dezfuli, Sebastian Günther, Max Mühlhäuser","Embedding sensors into objects allow them to recognize various interactions. However, sensing usually requires active electronics that are often costly, need time to be assembled, and constantly draw power. Thus, we propose off-line sensing: passive 3D-printed sensors that detect one-time interactions, such as accelerating or flipping, but neither require active electronics nor power 	[...]",https://doi.org/10.1145/3173574.3173756,http://hcie.csail.mit.edu/fabpub/img/offlinesensing.jpg,3D Printing; Digital Fabrication; Capacitive Sensing; Metamaterial; Mechanism; Input; Sensors,,,
19,2018,Demonstrating printed paper actuator: A Low-cost reversible actuation and sensing Method for shape Changing Interfaces,ACM CHI,"Guanyun Wang, Youngwook Do, Tingyu Cheng, Humphrey Yang, Ye Tao, Jianzhe Gu, Byoungkwon An, Lining Yao","We demonstrate printed paper actuator as a low cost, reversible and electrical actuation and sensing method. This is a novel but easily accessible enabling technology that expands upon the library of actuation-sensing materials in HCI. By integrating three physical phenomena, including the bilayer bending actuation, the shape memory effect of the thermoplastic and   	[...]",https://doi.org/10.1145/3173574.3174143,http://hcie.csail.mit.edu/fabpub/img/printedpaperactuator.jpg,Paper Actuator; Paper Interface; 3D Printing; 4D Printing; Shape Memory Polymer; Thermoplastic; Self-Folding; Shape Changing,,,
20,2018,Papercut: Digital Fabrication and Design for Paper Cutting,ACM CHI,"Lijuan Liu, Yang Chen, Pinhao Wang, Yizhou Liu, Caowei Zhang, Xuan Li, Cheng Yao, Fangtian Ying","Chinese Paper-cut is an ancient folk art being thought to have originated in the 6th century. In traditional Paper-cut, it is necessary for workers or amateurs who have fertile imagination and professional cutting skills to achieve good visual enjoyment. However, this posed a challenge in pattern design and a dimensional imagination barrier in fabrication, it also requires sufficient training in  	[...]",https://doi.org/10.1145/3170427.3188522,http://hcie.csail.mit.edu/fabpub/img/papercut.PNG,Paper-Cut; Digital Design; Fabrication; Computational Toolkit; Interactive Instruction; Cultural Heritage,,,
21,2018,skin+: Fabricating soft fluidic user interfaces for Enhancing On-skin experiences and interactions,ACM CHI,"Yanan Wang, Shijian Luo, Hebo Gong, Fei Xu, Rujia Chen, Shuai Liu, Preben Hansen","Human skin is the largest organ on our body not only senses and external environment. A growing number of researchers devote themselves to design seamless interfaces directly on skin. In this late-breaking work, we propose a novel way for creating dynamic 2.5D skin textures, called skin+, a soft fluidic mini-scale user interface by introducing fluidic actuation. We have created four 	[...]",https://doi.org/10.1145/3170427.3188443,http://hcie.csail.mit.edu/fabpub/img/skinfab.PNG,On-Skin Wearables; Soft Fluidic Interfaces; Hydraulic Actuation; Soft Fabrication; Interactions,,,
22,2017,Computational Design of Wind-up Toys,ACM SIGGRAPH ASIA,"Peng Song, Xiaofei Wang, Xiao Tang, Chi-Wing Fu, Hongfei Xu, Ligang Liu, Niloy Mitra","This paper presents a computational system to aid the design of wind-up toys, focusing on constructing a compact internal wind-up mechanism to realize user-requested part motions. The key contributions include an analytical modeling of a wide variety of elemental mechanisms found in common wind-up toys, including their geometry and kinematics, conceptual design of wind-up mechanisms by computing motion transfer trees to realize the requested part motions, automatic construction [...]",https://dl.acm.org/citation.cfm?doid=3130800.3130808,http://hcie.csail.mit.edu/fabpub/img/windup_toys.jpg,Toy Modeling; Mechanical Assembly; Wind-Up Mechanism; Kinematic Pair; Computational Design; 3D Printing,,,
23,2017,Computational Design and Fabrication of Soft Pneumatic Objects with Desired Deformations,ACM SIGGRAPH ASIA,"Li-Ke Ma, Yizhong Zhang, Yang Liu, Kun Zhou, Xin Tong","This paper presents an end-to-end solution for design and fabrication of soft pneumatic objects with desired deformations. Given a 3D object with its rest and deformed target shapes, the method automatically optimizes the chamber	structure and material distribution inside the object volume so that the fabricated object can deform to [...]",https://dl.acm.org/citation.cfm?doid=3130800.3130850,http://hcie.csail.mit.edu/fabpub/img/CDF_softPneumatic.jpg,Soft Pneumatic Objects; Computational Fabrication; 3D Printing,,,
24,2017,MetaSilicone: Design and Fabrication of Composite Silicone with Desired Mechanical Properties,ACM SIGGRAPH ASIA,"Jonas Zehnder, Espen Knoop, Moritz Bächer, Bernhard Thomaszewski","This paper presents a method for designing and fabricating MetaSilicones---composite silicone rubbers that exhibit desired macroscopic mechanical properties. The underlying principle of the approach is to inject spherical inclusions of a liquid dopant material into a silicone matrix material. By varying the number, size, and locations [...]",https://dl.acm.org/citation.cfm?doid=3130800.3130881,http://hcie.csail.mit.edu/fabpub/img/MetaSilicone.jpg,Composite Silicone; 3D Printing; Mechanical Properties; Computational Fabrication,,,
25,2017,Scattering-aware Texture Reproduction for 3D Printing,ACM SIGGRAPH ASIA,"Oskar Elek, 	Denis Sumin, 	Ran Zhang, 	Tim Weyrich, 	Karol Myszkowski, 	Bernd Bickel, 	Alexander Wilkie, 	Jaroslav Křivánek","This paper uses heterogeneous scattering to obtain the impression of a crisp albedo texture on top of the 3D print, by optimizing for a fully volumetric material distribution that preserves the target appearance. The method employs an efficient numerical optimizer on top of a general Monte-Carlo simulation of heterogeneous scattering, supported by a practical calibration procedure to obtain scattering parameters from a given set of printer materials.[...]",https://dl.acm.org/citation.cfm?doid=3130800.3130890,http://hcie.csail.mit.edu/fabpub/img/Scattering3DPrint.jpg,Computational Fabrication; Appearance Reproduction; Appearance Enhancement; Sub-Surface Light Transport,,,
26,2017,3D Printing Wireless Connected Objects,ACM SIGGRAPH ASIA,"Vikram Iyer, 	Justin Chan, 	Shyamnath Gollakota","This paper presents toolkit for wireless connectivity that can be integrated with 3D digital models and fabricated using commodity desktop 3D printers and commercially available plastic filament materials. The work introduces the first computational designs that 1) send data to commercial RF receivers including Wi-Fi, enabling 3D printed wireless sensors and input widgets, and [...]",https://doi.org/10.1145/3130800.3130822,http://hcie.csail.mit.edu/fabpub/img/3DPrintWifi.jpg,Backscatter; Internet of Things,,,
27,2017,Reconfigurable Interlocking Furniture,ACM SIGGRAPH ASIA,"Peng Song, 	Chi-Wing Fu, 	Yueming Jin, 	Hongfei Xu, 	Ligang Liu, 	Pheng-Ann Heng, 	Daniel Cohen-Or","This paper presents computational methods as tools to assist the design and construction of reconfigurable assemblies, typically for furniture. The authors present the compatible decomposition as a weakly-constrained dissection problem, and derive its solution based on a dynamic bipartite graph to construct parts across multiple forms[...]",https://doi.org/10.1145/3130800.3130803,http://hcie.csail.mit.edu/fabpub/img/ReconfigInterlocking.jpg,Reconfigurable; Furniture Assembly; Computational Design; Mechanical Interlocking; Joints; Co-Analysis; Dissection,,,
28,2017,Fabricable Tile Decors,ACM SIGGRAPH ASIA,"Weikai Chen, 	Yuexin Ma, 	Sylvain Lefebvre, 	Shiqing Xin, 	Jonàs Martínez, 	Wenping Wang","This paper presents an approach to model and fabricate surface-like objects composed of connected tiles, which can be used as objects in daily life, such as ornaments, covers, shades or handbags.[...]",https://doi.org/10.1145/3130800.3130817,http://hcie.csail.mit.edu/fabpub/img/fabtiledecor.jpg,Fabrication; Tiles; Packing; Foldable,,,
29,2017,Edible retroreflector,ACM VRST,"Takahiro Uji, Yiting Zhang,  Hiromasa Oku","This paper proposes an edible retroreflector made from transparent foodstuffs. We found that kanten, or Japan agar, which is a traditional Japanese cooking ingredient used to form a transparent jelly, was suitable for forming such optical devices. A recipe for an edible retroreflector using kanten was developed. A prototype made from kanten showed a retroreflective function in reflectance measurement experiments. 	[...]",https://doi.org/10.1145/3139131.3139148,http://hcie.csail.mit.edu/fabpub/img/Uji_VRST2017.jpg,Optical Marker; Retroreflector; Edible; Food,,,
30,2017,iSoft: A Customizable Soft Sensor with Real-time Continuous Contact and Stretching Sensing,ACM UIST,"Sang Ho Yoon, Ke Huo, Yunbo Zhang, Guiming Chen, Luis Paredes, Subramanian Chidambaram,  Karthik Ramani","We present iSoft, a single volume soft sensor capable of sensing real-time continuous contact and unidirectional stretching. We propose a low-cost and an easy way to fabricate such piezoresistive elastomer-based soft sensors for instant interactions. We employ an electrical impedance tomography (EIT) technique to estimate changes of resistance distribution on the sensor caused by fingertip contact. 	[...]",https://doi.org/10.1145/3126594.3126654,http://hcie.csail.mit.edu/fabpub/img/Yoon_UIST2017.JPG,Wearables; Soft Sensor; Sensing Technique; Input Device; Customization,,,
31,2017,"StrutModeling: A Low-Fidelity Construction Kit to Iteratively Model, Test, and Adapt 3D Objects",ACM UIST,"Danny Leen, Raf Ramakers, Kris Luyten","We present StrutModeling, a computationally enhanced construction kit that enables users without a 3D modeling background to prototype 3D models by assembling struts and hub primitives in physical space. Physical 3D models are immediately captured in software and result in readily available models for 3D printing. Given the concrete physical format of StrutModels, modeled objects can be tested and fine tuned in the presence of existing objects and specific needs of users. 	[...]",https://doi.org/10.1145/3126594.3126643,http://hcie.csail.mit.edu/fabpub/img/Danny_UIST2017.JPG,Tangible Modeling; Construction Kit; 3D Modeling; Personal/Digital Fabrication,,,
32,2017,BlowFab: Rapid Prototyping for Rigid and Reusable Objects using Inflation of Laser-cut Surfaces,ACM UIST,"Junichi Yamaoka, Ryuma Niiyama, Yasuaki Kakehi","This study proposes BlowFab, a prototyping method used to create a 2.5-dimensional prototype in a short time by combining laser cutting and blow molding techniques. The user creates adhesive areas and inflatable areas by engraving and cutting multilayered plastic sheets using a laser cutter. These adhesive areas are fused automatically by overlapping two crafted sheets and softening them with a heater. The user can then create hard prototypes by injecting air into the sheets. 	[...]",https://doi.org/10.1145/3126594.3126624,http://hcie.csail.mit.edu/fabpub/img/Junichi_UIST2017.JPG,Fabrication; Prototyping/Implementation; Creativity Support; Smart materials,,,
