ID,Year,Title,Conference,Authors,Abstract,DOI,Thumbtail,Keywords,,,
94,2016,Stenciling: Designing Structurally-Sound Surfaces with Decorative Patterns,ACM SGP,"Christian Schumacher, Bernhard Thomaszewski,  Markus Gross","We present a novel method to design shells with artistic cutouts in a manner that produces 	a stable final result. The process of stenciling, removing material with a fixed shape, 	is a particularly appealing way to introduce a decorative pattern 	into the design of architectural structures, furniture, or household objects. [...]",https://diglib.eg.org/handle/10.1111/cgf12967,http://hcie.csail.mit.edu/fabpub/img/stenciling_sgp2016.jpg,Shell Design; Decorative Patterns; Stencils; 3D Printing,,,
95,2016,Printed Perforated Lampshades for Continuous Projective Images,ACM SIGGRAPH,"Haisen Zhao, Lin Lu, Yuan Wei, Dani Lischinski, Andrei Sharf, Daniel Cohen-Or, Baoquan Chen","We present a technique for designing 3D-printed perforated lampshades that project 	continuous grayscale images onto the surrounding walls. Given the geometry of the 	lampshade and a target grayscale image, our method computes a distribution of tiny 	holes over the shell, such that the combined footprints of the 	light emanating through the holes form the target image on a nearby diffuse surface. [...]",https://doi.org/10.1145/2907049,http://hcie.csail.mit.edu/fabpub/img/Zhao_SG2016.jpg,Light Projection; Perforation,,,
96,2016,CofiFab: coarse-to-fine fabrication of large 3D objects,ACM SIGGRAPH,"Peng Song, Bailin Deng, Ziqi Wang, Zhichao Dong, Wei Li, Chi-Wing Fu,  Ligang Liu","This paper presents CofiFab, a coarse-to-fine 3D fabrication solution, combining 3D printing and 2D laser cutting for cost-effective fabrication of large objects at lower cost and higher speed. Our key approach is to first build coarse internal base structures within the given 3D object using laser cutting, and then attach thin 3D-printed parts, as an external shell, onto the base to recover the fine surface details. [...]",http://dl.acm.org/citation.cfm?id=2925876,http://hcie.csail.mit.edu/fabpub/img/cofifab.jpg,3D Printing; Laser Cutting; Assembly; Interlocking,,,
97,2016,Connected fermat spirals for layered fabrication,ACM SIGGRAPH,"Haisen Zhao, Fanglin Gu, Qi-Xing Huang, Jorge Garcia, Yong Chen, Changhe Tu, Bedrich Benes, Hao Zhang, Daniel Cohen-Or,  Baoquan Chen","We develop a new kind of ""space-filling"" curves, connected Fermat spirals, and show their compelling properties as a tool path fill pattern for layered fabrication. Unlike classical space-filling curves such as the Peano or Hilbert curves, which constantly wind and bind to preserve locality, connected Fermat spirals are formed mostly by long, low-curvature paths. This geometric property, along with continuity, influences the quality and efficiency of layered fabrication.",http://dl.acm.org/citation.cfm?id=2925958,http://hcie.csail.mit.edu/fabpub/img/fermatspirals.jpg,Connected Fermat Spirals; Space-Filling Curve; Layered Fabrication; Tool Path; Continuous Fill Pattern,,,
98,2016,Procedural voronoi foams for additive manufacturing,ACM SIGGRAPH,"Jonás Martìnez, Jérémie Dumas,  Sylvain Lefebvre","In this paper we propose to study procedural, aperiodic microstructures inspired by Voronoi open-cell foams. The absence of regularity affords for a simple approach to grade the foam geometry --- and thus its mechanical properties --- within a target object and its surface. Rather than requiring a global optimization process, the microstructures are directly generated to exhibit a specified elastic behavior. [...]",http://dl.acm.org/citation.cfm?id=2925922,http://hcie.csail.mit.edu/fabpub/img/voronoifoams.jpg,3D Printing; Additive Manufacturing; Procedural Modeling; Material Design,,,
99,2016,Printing arbitrary meshes with a 5DOF wireframe printer,ACM SIGGRAPH,"Rundong Wu, Huaishu Peng, François Guimbretière,  Steve Marschner","We formalize the collision avoidance problem using a directed graph, and propose an algorithm that finds a locally minimal set of constraints on the order of edges that guarantees there will be no collisions. Then a second algorithm orders the edges so that the printing progresses smoothly. Though meshes do exist that still cannot be printed, our method prints a wide range of models that previous methods cannot, and it provides a fundamental enabling algorithm for future development of wireframe printing. [...]",http://dl.acm.org/citation.cfm?id=2925966,http://hcie.csail.mit.edu/fabpub/img/printingarbitrary.jpg,3D Printing; Fabrication; Computational Craft; CAD; Rapid Prototyping; Interactive Devices,,,
100,2016,Designing structurally-sound ornamental curve networks,ACM SIGGRAPH,"Jonas Zehnder, Stelian Coros,  Bernhard Thomaszewski","We present a computational tool for designing ornamental curve networks---structurally-sound physical surfaces with user-controlled aesthetics. In contrast to approaches that leverage texture synthesis for creating decorative surface patterns, our method relies on user-defined spline curves as central design primitives. [...]",http://dl.acm.org/citation.cfm?id=2925888,http://hcie.csail.mit.edu/fabpub/img/curvenetworks.jpg,Curve Networks; Computational Design; 3D Printing,,,
101,2016,Synthesis of filigrees for digital fabrication,ACM SIGGRAPH,"Weikai Chen, Xiaolong Zhang, Shiqing Xin, Yang Xia, Sylvain Lefebvre,  Wenping Wang","Filigrees are thin patterns found in jewelry, ornaments and lace fabrics. They are often formed of repeated base elements manually composed into larger, delicate patterns. Digital fabrication simplifies the process of turning a virtual model of a filigree into a physical object. However, designing a virtual model of a filigree remains a time consuming and challenging task. The difficulty lies in tightly packing together the base elements while covering a target surface.  [...]",http://dl.acm.org/citation.cfm?id=2925911,http://hcie.csail.mit.edu/fabpub/img/filligrees.jpg,Medial Axis; Hausdorff Distance; Filigree Synthesis; Digital Fabrication,,,
102,2016,Computational design of reconfigurables,ACM SIGGRAPH,"Akash Garg, Alec Jacobson,  Eitan Grinspun","A reconfigurable is an object or collection of objects whose transformation between various states defines its functionality or aesthetic appeal. For example, consider a mechanical assembly composed of interlocking pieces, a transforming folding bicycle, or a space-saving arrangement of apartment furniture.  [...]",http://dl.acm.org/citation.cfm?id=2925900,http://hcie.csail.mit.edu/fabpub/img/reconfigurables.jpg,Computational Design,,,
103,2016,Acoustic voxels: computational optimization of modular acoustic filters,ACM SIGGRAPH,"Dingzeyu Li, David I. W. Levin, Wojciech Matusik,  Changxi Zheng","A reconfigurable is an object or collection of objects whose transformation between various states defines its functionality or aesthetic appeal. For example, consider a mechanical assembly composed of interlocking pieces, a transforming folding bicycle, or a space-saving arrangement of apartment furniture.  [...]",http://dl.acm.org/citation.cfm?id=2925960,http://hcie.csail.mit.edu/fabpub/img/acousticvoxels.jpg,Shape Optimization; Fabrication; Computational Design; Acoustic Impedance; Transmission Loss,,,
104,2016,Computational thermoforming,ACM SIGGRAPH,"Christian Schüller, Daniele Panozzo, Anselm Grundhöfer, Henning Zimmer, Evgeni Sorkine,  Olga Sorkine-Hornung","We propose a method to fabricate textured 3D models using thermoforming. Differently from industrial techniques, which target mass production of a specific shape, we propose a combined hardware and software solution to manufacture customized, unique objects. Our method simulates the forming process and converts the texture of a given digital 3D model into a pre-distorted image that we transfer onto a plastic sheet. During thermoforming, the sheet deforms to create a faithful physical replica of the digital model. [...]",http://dl.acm.org/citation.cfm?id=2925914,http://hcie.csail.mit.edu/fabpub/img/schuller_sg2016.png,Thermoforming; Vacuum Forming; Digital Fabrication; Texture Transfer; Viscoplastic Sheets; Physical Simulation,,,
105,2016,Balancing 3D models with movable masses,EUROGRAPHICS,"Romain Prévost, Moritz Bächer, Wojciech Jarosz, Olga Sorkine-Hornung","e present an algorithm to balance 3D printed models using movable embedded masses. 	As input, the user provides a 3D model together with the desired suspension, standing, 	and immersion objectives. Our technique then determines the placement and suitable sizing 	of a set of hollow capsules with embedded metallic spheres, 	leveraging the resulting multiple centers of mass to simultaneously satisfy the combination of these objectives. [...]",https://doi.org/10.2312/vmv.20161337,http://hcie.csail.mit.edu/fabpub/img/Romain_EG2016.jpg,3D Printing; Movable Masses; Balancing Algorithm,,,
106,2016,Buoyancy Optimization for Computational Fabrication,EUROGRAPHICS,"Lingfeng Wang,  Emily Whiting","This paper introduces a design and fabrication pipeline for creating floating forms. Our method optimizes for buoyant equilibrium and stability of complex 3D shapes, applying a voxel-carving technique to control the mass distribution. 	The resulting objects achieve a desired floating pose defined by a user-specified waterline height and orientation. [...]",http://dx.doi.org/10.1111/cgf.12810,http://hcie.csail.mit.edu/fabpub/img/buoyancy_eg2016.jpg,Computational Design; Buoyancy Optimization; Stability; Mass Distribution,,,
107,2016,Saliency-Preserving Slicing Optimization for Effective 3D Printing,EUROGRAPHICS,"Weiming Wang, Haiyuan Chao, Jing Tong, Zhouwang Yang, Xin Tong, Hang Li, Xiuping Liu,  Ligang Liu","We present an adaptive slicing scheme for reducing the manufacturing time for 3D printing systems. 	Based on a new saliency-based metric, our method optimizes the thicknesses of slicing layers to 	save printing time and preserve the visual quality of the printing results. We formulate the problem as a 	constrained optimization and compute the slicing result via a two-step optimization scheme.  [...]",http://dx.doi.org/10.1111/cgf.12527,http://hcie.csail.mit.edu/fabpub/img/saliency_eg2016.jpg,3D Printing; Mesh Saliency; Adaptive Slicing; Segmentation; Visual Quality,,,
108,2016,DefSense: Computational Design of Customized Deformable Input Devices,ACM CHI,"Moritz Bächer, Benjamin Hepp, Fabrizio Pece, Paul G. Kry, Bernd Bickel, Bernhard Thomaszewski, Otmar Hilliges",We propose to embed piezoresistive sensing elements into flexible 3D printed objects. These sensing elements are then utilized to recover rich and natural user interactions at runtime. Designing such objects manually is a challenging and hard problem for all but the simplest geometries and deformations. Our method simultaneously optimizes the internal routing of the sensing elements and computes a mapping from low-level sensor readings to user-specified outputs in order to minimize reconstruction error. [...],https://doi.org/10.1145/2858036.2858354,http://hcie.csail.mit.edu/fabpub/img/Moritz_CHI2016.jpg,Input Devices; Fabrication; Flexible; Sensors; Reconstruction,,,
109,2016,"CardBoardiZer: Creatively Customize, Articulate and Fold 3D Mesh Models",ACM CHI,"Yunbo Zhang, Wei Gao, Luis Paredes, Karthik Ramani","This paper presents CardBoardiZer, a rapid cardboard based prototyping platform that allows everyday sculptural 	3D models to be easily customized, articulated and folded. We develop a building platform to allow the designer to 	1) import a desired 3D shape, 2) customize articulated partitions into planar or volumetric foldable patterns, 	and 3) define rotational movements between partitions.  [...]",https://doi.org/10.1145/2858036.2858362,http://hcie.csail.mit.edu/fabpub/img/Yunbo_CHI2017.jpg,Foldable Design; Articulated Model; Cardboard Prototyping,,,
110,2016,ExoSkin: On-Body Fabrication,ACM CHI,"Madeline Gannon, Tovi Grossman,  George Fitzmaurice","We present ExoSkin, a hybrid fabrication system for designing and printing digital artifacts directly on the body. ExoSkin utilizes a custom built fabrication machine designed specifically for on-body printing. ExoSkin utilizes a custom built fabrication machine designed specifically for on-body printing. We demonstrate the potential of on-body fabrication with a set of sample workflows, and share feedback from initial observation sessions. [...]",http://dl.acm.org/citation.cfm?id=2858576,http://hcie.csail.mit.edu/fabpub/img/exoskin_chi2016.jpg,On-Body Fabrication; Projection; Hybrid Fabrication,,,
111,2016,The Hybrid Bricolage: Bridging Parametric Design with Craft through Algorithmic Modularity,ACM CHI,"Tamara Anna Efrat, Moran Mizrahi,  Amit Zoran","Our hypothesis is that the arrangement of parametric design in modular representation, in the form of a catalog, can assist makers unfamiliar with this practice. We evaluate this assumption in the realm of bag design, through a Honeycomb Smocking Pattern Catalog and custom Computer-Aided Smocking (CAS) design software. [...]",http://dl.acm.org/citation.cfm?doid=2858036.2858441,http://hcie.csail.mit.edu/fabpub/img/hybridbricolage_chi2016.jpg,Parametric Modeling; Crafting; Modular Representation,,,
112,2016,Foldem: Heterogeneous Object Fabrication via Selective Ablation of Multi-Material Sheets,ACM CHI,"Varun Perumal C, Daniel Wigdor","oldem, a novel method of rapid fabrication of objects with multi-material properties is presented. Our specially formulated Foldem sheet allows users to fabricate and easily assemble objects with rigid, bendable, and flexible properties using a standard laser-cutter. [...]",http://dl.acm.org/citation.cfm?id=2858135,http://hcie.csail.mit.edu/fabpub/img/foldam_chi2016.png,Multi-Material Sheets; Fabrication; Laser-Cutting,,,
113,2016,Steel-Sense: Integrating Machine Elements with Sensors by Additive Manufacturing,ACM CHI,"Tatyana Vasilevitsky, Amit Zoran","We present Steel-Sense, an approach to joining these two families of elements to create a new type of HCI design primitive. We leverage recent developments in 3D printing to embed sensing in metal structures that are otherwise difficult to equip with sensors, and present four design principles, implementing. [...]",http://dl.acm.org/citation.cfm?id=2858309,http://hcie.csail.mit.edu/fabpub/img/steelsense_chi2016.jpg,3D Printing; Sensors; Digital Fabrication; Hybrid Design; Machine Elements; Additive Manufacturing; Metal Printing,,,
114,2016,xPrint: A Modularized Liquid Printer for Smart Materials Deposition,ACM CHI,"Guanyun Wang, Lining Yao, Wen Wang, Jifei Ou, Chin-Yi Cheng,  Hiroshi Ishii","To meet the increasing requirements of HCI researchers who are looking into using liquid-based materials (e.g., hydrogels) to create novel interfaces, we present a design strategy for HCI researchers to build and customize a liquid-based smart material printing platform with off-the-shelf or easy-to-machine parts. For the hardware, we suggest a magnetic assembly-based modular design. [...]",http://dl.acm.org/citation.cfm?id=2858281,http://hcie.csail.mit.edu/fabpub/img/xprint_chi2016.jpg,Liquid Deposition Modeling Printer; 3D Printing; Smart Material Printing; Functional Material Printing; Responsive Material Printing; Smart Material Interface; Physical Interface; Shape Changing Interface,,,
115,2016,ChronoFab: Fabricating Motion,ACM CHI,"Rubaiat Habib Kazi, Tovi Grossman, Cory Mogk, Ryan Schmidt,  George Fitzmaurice","We present ChronoFab, a 3D modeling tool to craft motion sculptures, tangible representations of 3D animated models, visualizing an object's motion with static, transient, ephemeral visuals that are left behind. Our tool casts 3D modeling as a dynamic art-form by employing 3D animation and dynamic simulation for the modeling of motion sculptures. [...]",http://dl.acm.org/citation.cfm?id=2858138,http://hcie.csail.mit.edu/fabpub/img/chronofab_chi2016.jpg,Motion Sculpture; Fabrication; Animation,,,
116,2016,What you Sculpt is What you Get: Modeling Physical Interactive Devices with Clay and 3D Printed Widgets,ACM CHI,"Michael D. Jones, Kevin Seppi,  Dan R. Olsen","We present a method for fabricating prototypes of interactive computing devices from clay sculptures without requiring the designer to be skilled in CAD software. The method creates a ""what you sculpt is what you get"" process that mimics the ""what you see is what you get"" processes used in interface design for 2D screens. [...]",http://dl.acm.org/citation.cfm?id=2858493,http://hcie.csail.mit.edu/fabpub/img/wsc_chi2016.jpg,Physical Computing; 3D Printing; Prototypes,,,
117,2016,HotFlex: Post-print Customization of 3D Prints Using Embedded State Change,ACM CHI,"Daniel Groeger, Elena Chong Loo,  Jürgen Steimle","We propose HotFlex: a new approach allowing precisely located parts of a 3D object to transition on demand from a solid into a deformable state and back. This approach enables intuitive hands-on remodeling, personalization, and customization of a 3D object after it is printed. We introduce the approach and present an implementation based on computer-controlled printed heating elements that are embedded within the 3D object. [...]",http://dl.acm.org/citation.cfm?id=2858191,http://hcie.csail.mit.edu/fabpub/img/hotflex_chi2016.jpg,3D Printing; 3D Modeling; Prototyping; Fabrication; Tangible Interaction; Shape Change; Printed Electronics,,,
118,2016,"RetroFab: A Design Tool for Retrofitting Physical Interfaces using Actuators, Sensors and 3D Printing",ACM CHI,"Raf Ramakers, Fraser Anderson, Tovi Grossman,  George Fitzmaurice","We present RetroFab, an end-to-end design and fabrication environment that allows non-experts to retrofit physical interfaces. Our approach allows for changing the layout and behavior of physical interfaces. Unlike customizing software interfaces, physical interfaces are often challenging to adapt because of their rigidity. With RetroFab, a new physical interface is designed that serves as a proxy interface for the legacy controls that are now operated using actuators. [...]",http://dl.acm.org/citation.cfm?id=2858485,http://hcie.csail.mit.edu/fabpub/img/retrofab_chi2016.jpg,Fabrication; Augmentation; Physical Interface; Reverse Engineering,,,
119,2016,On-The-Fly Print: Incremental Printing While Modelling,ACM CHI,"Huaishu Peng, Rundong Wu, Steve Marschner,  François Guimbretière","In this paper we propose On-the-Fly Print: a 3D modeling approach that allows the user to design 	3D models digitally while having a low-fidelity physical wireframe model printed in parallel. 	Our software starts printing features as soon as they are created and updates the physical model as needed. [...]",https://doi.org/10.1145/2858036.2858106,http://hcie.csail.mit.edu/fabpub/img/ontheflyprint_chi2016.jpg,3D Printing; Fabrication; Computational Craft; CAD; Rapid Prototyping; Interactive Devices,,,
120,2016,"Cilllia: 3D Printed Micro-Pillar Structures for Surface Texture, Actuation and Sensing",ACM CHI,"Jifei Ou, Gershon Dublon, Chin-Yi Cheng, Felix Heibeck, Karl Willis,  Hiroshi Ishii","This work presents a method for 3D printing hair-like structures on both flat and curved surfaces. 	It allows a user to design and fabricate hair geometries that are smaller than 100 micron. 	We built a software platform to let users quickly define the hair angle, thickness, density, and height. [...]",https://doi.org/10.1145/2858036.2858257,http://hcie.csail.mit.edu/fabpub/img/cilllia_chi2016.png,3D Printing; Surface Texture; Actuated Interfaces; Acoustic Sensing; Digital Fabrication; Hair,,,
121,2016,Destructive Games: Creating Value by Destroying Valuable Physical Objects,ACM CHI,"David Eickhoff, Stefanie Mueller,  Patrick Baudisch","We present a series of games that result in valuable physical objects being destroyed objects owned by the players. Interestingly, we found that we can design these games to be desirable to play, despite the loss of the object, by instead producing social value.  [...]",http://dl.acm.org/citation.cfm?id=2858113,http://hcie.csail.mit.edu/fabpub/img/destructivegames.jpg,Destruction; Laser Cutting; Games; Personal Objects; Interactive Art,,,
122,2016,"Understanding Newcomers to 3D Printing: Motivations, Workflows, and Barriers of Casual Makers",ACM CHI,"Nathaniel Hudson, Celena Alcock,  Parmit K. Chilana","We present a study of casual makers, users who have no prior experience with fabrication and mainly explore walk-up-and-use 3D printing services at public print centers, such as libraries, universities, and schools. We carried out 32 interviews with casual makers, print center operators, and fabrication experts to understand the motivations, workflows, and barriers in appropriating 3D printing technologies. [...]",https://doi.org/10.1145/2858036.2858266,http://hcie.csail.mit.edu/fabpub/img/underto3d_chi2016.jpg,3D Printing; Casual Makers; 3D Modeling; Learning Barriers,,,
123,2015,AutoConnect: Computational Design of 3D-Printable Connectors,ACM SIGGRAPH ASIA,"Yuki Koyama, Shinjiro Sueda, Emma Steinhardt, Takeo Igarashi, Ariel Shamir, Wojciech Matusik","We present AutoConnect, an automatic method that creates customized, 3D-printable connectors attaching two physical objects together. 	Users simply position and orient virtual models of the two objects that they want to connect and indicate some auxiliary information such as weight and dimensions. 	Then, AutoConnect creates several alternative designs that users can choose from for 3D printing. The design of the connector is created by combining two holders, one for each object. [...]",https://doi.org/10.1145/2816795.2818060,http://hcie.csail.mit.edu/fabpub/img/Koyama_SGA2015.jpg,3D Printing; Fabrication; Functional Design,,,
124,2015,Interactive design of 3D-printable robotic creatures,ACM SIGGRAPH ASIA,"Vittorio Megaro, Bernhard Thomaszewski, Maurizio Nitti, Otmar Hilliges, Markus Gross,  Stelian Coros","We present an interactive design system that allows casual users to quickly create 3D-printable robotic creatures. Our approach automates the tedious parts of the design process while providing ample room for customization of morphology, proportions, gait and motion style. The technical core of our framework is an efficient optimization-based solution that generates stable motions for legged robots of arbitrary designs. [...]",http://dx.doi.org/10.1145/2816795.2818137,http://hcie.csail.mit.edu/fabpub/img/megaro_sga2015.png,Physical Characters; Robotics; 3D Printing,,,
125,2015,Perceptual models of preference in 3D printing direction,ACM SIGGRAPH ASIA,"Xiaoting Zhang, Xinyi Le, Athina Panotopoulou, Emily Whiting,  Charlie C. L. Wang","This paper introduces a perceptual model for determining 3D printing orientations. Additive manufacturing methods involving low-cost 3D printers often require robust branching support structures to prevent material collapse at overhangs. Although the designed shape can successfully be made by adding supports, residual material remains at the contact points after the supports have been removed, resulting in unsightly surface artifacts. Moreover, fine surface details on the fabricated model can easily be damaged while removing supports. [...]",http://dl.acm.org/citation.cfm?id=2818121,http://hcie.csail.mit.edu/fabpub/img/zhang_sga2015.jpg,Orientation; Human Preference; Perceptual Model; Supporting Structure; 3D Printing,,,
126,2015,Makers' Marks: Physical Markup for Designing and Fabricating Functional Objects,ACM UIST,"Valkyrie Savage, Sean Follmer, Jingyi Li, Björn Hartmann","We aim to allow makers to design and 3D print functional mechanical and electronic assemblies. 	Based on a formative exploration, we created Makers' Marks, a system based on physically authoring assemblies with sculpting materials and annotation stickers. 	Makers physically sculpt the shape of an object and attach stickers to place existing parts or high-level features (such as parting lines). [...]",https://doi.org/10.1145/2807442.2807508,http://hcie.csail.mit.edu/fabpub/img/Savage_UIST2015.jpg,Tangible Design Tools; 3D Printing,,,
127,2015,ReForm: Integrating Physical and Digital Design through Bidirectional Fabrication,ACM UIST,"Christian Weichel, John Hardy, Jason Alexander,  Hans Gellersen","To provide a more flexible design process that allows objects to iteratively evolve through 	both digital and physical input, we introduce bidirectional fabrication. To demonstrate the concept, 	we built ReForm, a system that integrates digital modeling with shape input, shape output, 	annotation for machine commands, and visual output. [...]",http://dx.doi.org/10.1145/2807442.2807451,http://hcie.csail.mit.edu/fabpub/img/reform_uist2015.jpg,Digital Fabrication; Clay-Modeling; Prototyping; Iterative Design,,,
128,2015,LaserStacker: Fabricating 3D Objects by Laser Cutting and Welding,ACM UIST,"Udayan Umapathi, Hsiang-Ting Chen, Stefanie Mueller, Ludwig Wall, Anna Seufert,  Patrick Baudisch","We propose eliminating the assembly step with our system LaserStacker. 	The key idea is to use the laser cutter to not only cut but also to weld. 	Users place not one acrylic sheet, but a stack of acrylic sheets into their cutter. [...]",http://dx.doi.org/10.1145/2807442.2807512,http://hcie.csail.mit.edu/fabpub/img/laserstacker_uist2015.jpg,Rapid Prototyping; Laser Cutting,,,
