ID,Year,Title,Conference,Authors,Abstract,DOI,Thumbtail,Keywords,,,
266,2018,An Adaptive Parameterization for Efficient Material Acquisition and Rendering,ACM SIGGRAPH ASIA,"Jonathan Dupuy, Wenzel Jakob ","One of the key ingredients of any physically based rendering system is a detailed specification characterizing the interaction of light and matter of all materials present in a scene, typically via the Bidirectional Reflectance Distribution Function (BRDF). Despite their utility, access to real-world BRDF datasets remains limited: this is because measurements involve scanning a four-dimensional domain at sufficient resolution, a tedious and often infeasibly time-consuming process. We propose a new parameterization that automatically adapts to the behavior of a material, warping the underlying 4D domain so that most of the volume maps to regions where the BRDF takes on non-negligible values, while irrelevant regions are strongly compressed.[...] ",https://doi.org/10.1145/3272127.3275059,https://hcie.csail.mit.edu/fabpub/img/adaptive-material.png,Microfacet Theory; Spectral BRDF; Photorealistic Rendering,,,
267,2018,Acquiring Spatially Varying Appearance of Printed Holographic Surfaces,ACM SIGGRAPH ASIA,"Antoine Toisoul, Daljit Singh Dhillon, Abhijeet Ghosh","We present two novel and complimentary approaches to measure diffraction effects in commonly found planar spatially varying holographic surfaces. Such surfaces are increasingly found in various decorative materials such as gift bags, holographic papers, clothing and security holograms, and produce impressive visual effects that have not been previously acquired for realistic rendering. Such holographic surfaces are usually manufactured with one dimensional diffraction gratings that are varying in periodicity and orientation over an entire sample in order to produce a wide range of diffraction effects such as gradients and kinematic (rotational) effects [...] ",https://doi.org/10.1145/3272127.3275077,https://hcie.csail.mit.edu/fabpub/img/holographic.png,Diffraction; Wave Optics; Spectral; Polarization; Real-Time Rendering,,,
268,2018,Axis-Aligned Height-Field Block Decomposition of 3D Shapes,ACM SIGGRAPH ASIA,"Keunhong Park, Konstantinos Rematas, Ali Farhadi, Steve Seitz ","We propose a novel algorithm for decomposing general three-dimensional geometries into a small set of overlap-free height-field blocks, volumes enclosed by a flat base and a height-field surface defined with respect to this base. This decomposition is useful for fabrication methodologies such as 3-axis CNC milling, where a single milling pass can only carve a single height-field surface defined with respect to the machine tray but can also benefit other fabrication settings. Computing our desired decomposition requires solving a highly constrained discrete optimization problem, variants of which are known to be NP-hard [...] ",https://doi.org/10.1145/3204458,https://hcie.csail.mit.edu/fabpub/img/axis-aligned.png,Shape Decomposition; Fabrication,,,
269,2018,"Deep Multispectral Painting Reproduction Via Multi-Layer, Custom-Ink Printing",ACM SIGGRAPH ASIA,"Liang Shi, Vahid Babaei, Changil Kim, Michael Foshey, Yuanming Hu, Pitchaya Sitthi-Amorn, Szymon Rusinkiewicz, Wojciech Matusik ","We propose a worklow for spectral reproduction of paintings, which captures a painting’s spectral color, invariant to illumination, and reproduces it using multi-material 3D printing. We take advantage of the current 3D printers’ capabilities of combining highly concentrated inks with a large number of layers, to expand the spectral gamut of a set of inks. We use a data-driven method to both predict the spectrum of a printed ink stack and optimize for the stack layout that best matches a target spectrum [...]",https://doi.org/10.1145/3272127.3275057,https://hcie.csail.mit.edu/fabpub/img/multispectral-painting.png,Spectral Reproduction; Multi-Spectral Imaging; 3D Printing,,,
270,2018,PhotoShape: Photorealistic Materials for Large-Scale Shape Collections,ACM SIGGRAPH ASIA,"Keunhong Park, Konstantinos Rematas, Ali Farhadi, Steve Seitz","Existing online 3D shape repositories contain thousands of 3D models but lack photorealistic appearance. We present an approach to automatically assign high-quality, realistic appearance models to large scale 3D shape collections. The key idea is to jointly leverage three types of online data - shape collections, material collections, and photo collections, using the photos as reference to guide assignment of materials to shapes [...] ",https://doi.org/10.1145/3272127.3275066,https://hcie.csail.mit.edu/fabpub/img/photoshape.png,Image-Based Modeling; Shape Analysis; Appearance Transfer; Texture,,,
271,2018,DESIA: A General Framework for Designing Interlocking Assemblies,ACM SIGGRAPH ASIA,"Ziqi Wang, Peng Song, Mark Pauly","Interlocking assemblies have a long history in the design of puzzles, furniture, architecture, and other complex geometric structures. The key defining property of interlocking assemblies is that all component parts are immobilized by their geometric arrangement, preventing the assembly from falling apart. Computer graphics research has recently contributed design tools that allow creating new interlocking assemblies. [...] ",https://doi.org/10.1145/3272127.3275034,https://hcie.csail.mit.edu/fabpub/img/desia.png,3D Assembly; Interlocking; Component Parts; Joints; Computational Design; Directed Graph,,,
272,2018,Construction and Fabrication of Reversible Shape Transforms,ACM SIGGRAPH ASIA,"Shuhua Li, Ali Mahdavi-Amiri, Ruizhen Hu, Han Liu, Changqing Zou, Oliver Van Kaick, Xiuping Liu, Hui Huang, Hao Zhang","We study a new and elegant instance of geometric dissection of 2D shapes: reversible hinged dissection, which corresponds to a dual transform between two shapes where one of them can be dissected in its interior and then inverted inside-out, with hinges on the shape boundary, to reproduce the other shape, and vice versa. We call such a transform reversible inside-out transform or RIOT. [...] ",https://doi.org/10.1145/3272127.3275061,https://hcie.csail.mit.edu/fabpub/img/reversible-shape-transforms.png,Hinged Geometry Dissection; Reversible Inside-Out Shape Transform; Fabrication,,,
273,2018,3D Fabrication with Universal Building Blocks and Pyramidal Shells,ACM SIGGRAPH ASIA,"Xuelin Chen, Honghua Li, Chi-Wing Fu, Hao (Richard) Zhang, Daniel Cohen-Or, Baoquan Chen","We introduce a computational solution for cost-efficient 3D fabrication using universal building blocks. Our key idea is to employ a set of universal blocks, which can be massively prefabricated at a low cost, to quickly assemble and constitute a significant internal core of the target object, so that only the residual volume need to be 3D printed online [...] ",https://doi.org/10.1145/3272127.3275033,https://hcie.csail.mit.edu/fabpub/img/building-blocks.png,Fabrication; Building Blocks; Decomposition; 3D Printing; Cost Efficiency,,,
275,2019,Interactive Fabrication of CSG Models with Assisted Carving,ACM TEI,"Ammar Hattab, Gabriel Taubin","We propose a method that helps an unskilled user to carve a physical replica of a 3D CAD model while only using manual cutting tools. The method starts by analyzing the input CAD model and generates a set of carving instructions. Then using a projector, we project the instructions sequentially one at a time to a block of material to guide the user in performing each of them. After each cutting step, we use the projector-camera setup to 3D scan the object after cutting. And automatically align the scanned point cloud to the CAD model, to prepare the position for the next instruction. We demonstrate a complete system to support this operation and show several examples manually carved while using the system.",https://doi.org/10.1145/3294109.3295644,https://hcie.csail.mit.edu/fabpub/img/assisted-carving.png,Interactive Fabrication; Assisted Carving; Constructive Solid Modeling (CSG); Spatial Augmented Reality,,,
276,2019,Sequential Support: 3D Printing Dissolvable Support Material for Time-Dependent Mechanisms,ACM TEI,"Martin Nisser, Junyi Zhu, Tianye Chen, Katarina Bulovic, Parinya Punpongsanon, Stefanie Mueller","In this paper, we propose a different perspective on the use of support material: rather than printing support structures for overhangs, our idea is to make use of its transient nature, i.e. the fact that it can be dissolved when placed in a solvent, such as water. This enables a range of new use cases, such as quickly dissolving and replacing parts of a prototype during design iteration, printing temporary assembly labels directly on the ob-ject that leave no marks when dissolved, and creating time-dependent mechanisms, such as fading in parts of an image in a shadow art piece or releasing relaxing scents from a 3D printed structure sequentially over-night. Since we use regular support material (PVA), our approach works on consumer 3D printers without any modifications.",https://dl.acm.org/citation.cfm?id=3295630,https://hcie.csail.mit.edu/fabpub/img/sequential-support.jpg,3D Printing; Support Material,,,
277,2019,A Conversation with Actuators: An Exploratory Design Environment for Hybrid Materials,ACM TEI,"Cesar Torres, Molly Jane Nicholas, Sangyeon Lee, Eric Paulos","An exciting, expanding palette of hybrid materials is emerging that can be programmed to actuate by a range of external and internal stimuli. However, there exists a dichotomy between the physicality of the actuators and the intangible computational signal that is used to program them. For material practitioners, this lack of physical cues limits their ability to engage in a ""conversation with materials"" (CwM). This paper presents a creative workstation for supporting this epistemological style by bringing a stronger physicality to the computational signal and balance the conversation between physical and digital actors.",https://doi.org/10.1145/3294109.3295643,https://hcie.csail.mit.edu/fabpub/img/conversation-actuators.png,Creativity Support Tools; Computational Design; New Media,,,
278,2019,FormFab: Continuous Interactive Fabrication ,ACM TEI,"Stefanie Mueller, Anna Seufert, Huaishu Peng, Robert Kovacs, Kevin Reuss, Francois Guimbretiere, Patrick Baudisch","Several systems have illustrated the concept of interactive fabrication, i.e. rather than working through a digital editor, users make edits directly on the physical workpiece. However, so far the interaction has been limited to turn-taking, i.e., users first perform a command and then the system responds with physical feedback. In this paper, we present a first step towards interactive fabrication that changes the workpiece continuously while the user is manipulating it.",https://dl.acm.org/citation.cfm?id=3295620,https://hcie.csail.mit.edu/fabpub/img/formfab.png,Personal Fabrication; Interactive Fabrication; Direct Manipulation; 3D Modeling Tools,,,
279,2019,Strong 3D Printing by TPMS Injection,IEEE TVCG,"Xin Yan, Cong Rao, Lin Lu, Andrei Sharf, Haisen Zhao, Baoquan Chen","3D printed objects are rapidly becoming prevalent in science, technology and daily life. An important question is how to obtain strong and durable 3D models using standard printing techniques. This question is often translated to computing smartly designed interior structures that provide strong support and yield resistant 3D models. In this paper we suggest a combination between 3D printing and material injection to achieve strong 3D printed objects. We utilize triply periodic minimal surfaces (TPMS) to define novel interior support structures.",https://ieeexplore.ieee.org/document/8703138,https://hcie.csail.mit.edu/fabpub/img/TPMS-Injection.png,3D Printing; Minimal Surfaces; Inner Structures; Injection,,,
280,2019,Geodesy: Self-rising 2.5D Tiles by Printing along 2D Geodesic Closed Path,ACM CHI,"Jianzhe Gu, David E. Breen, Jenny Hu, Lifeng Zhu, Ye Tao, Tyson Van de Zande, Guanyun Wang, Yongjie Jessica Zhang, Lining Yao","Thermoplastic and Fused Deposition Modeling (FDM) based 4D printing are rapidly expanding to allow for space- and material-saving 2D printed sheets morphing into 3D shapes when heated. However, to our knowledge, all the known examples are either origami-based models with obvious folding hinges, or beam-based models with holes on the morphing surfaces. Morphing continuous double-curvature surfaces remains a challenge, both in terms of a tailored toolpath-planning strategy and a computational model that simulates it. Additionally, neither approach takes surface texture as a design parameter in its computational pipeline. To extend the design space of FDM-based 4D printing, in Geodesy, we focus on the morphing of continuous double-curvature surfaces or surface textures.",https://dl.acm.org/citation.cfm?doid=3290605.3300267,https://hcie.csail.mit.edu/fabpub/img/Geodesy.png,Shell Structure; Non-Developable Surface; 4D Printing; 3D Printing; Self-Folding; Morphing; Shape-Changing Interface,,,
281,2019,Shape Changing Surfaces and Structures: Design Tools and Methods for Electroactive Polymers,ACM CHI,"Karmen Franinović, Luke Franzke","Electroactive polymers (EAP) are a promising material for shape changing Interfaces, soft robotics and other novel design explorations. However, the uptake of EAP prototyping in design, art and architecture has been slow due to limited commercial availability, challenging high voltage electronics and lack of simple fabrication techniques. This paper introduces DIY tools for building and activating EAP prototypes, together with design methods for making novel Shape-changing surfaces and structures, outside of material science labs. We present iterations of our methods and tools, their use and evaluation in participatory workshops and public installations and how they affect the design outcomes.",https://dl.acm.org/citation.cfm?id=3300355,https://hcie.csail.mit.edu/fabpub/img/ElectroactivePolymers.png,Embodied Interaction; Programmable Materials; Electroactive Polymers; Active Materials; Smart Material Interfaces; ShapeChanging Interfaces,,,
282,2019,A-line: 4D Printing Morphing Linear Composite Structures,ACM CHI,"Guanyun Wang, Ye Tao, Ozguc Bertug Capunaman, Humphrey Yang, Lining Yao","This paper presents A-line, a 4D printing system for designing and fabricating morphing three-dimensional shapes out of simple linear elements. In addition to the commonly known benefit of 4D printing to save printing time, printing materials, and packaging space, A-line also takes advantage of the unique properties of thin lines, including their suitability for compliant mechanisms and ability to travel through narrow spaces and self-deploy or self-lock on site. A-line integrates a method of bending angle control in up to eight directions for one printed line segment, using a single type of thermoplastic material.",https://dl.acm.org/citation.cfm?doid=3290605.3300656,https://hcie.csail.mit.edu/fabpub/img/A-line.png,Line-Based Structure; Line-Shaped Interface; 4D Printing; 3D Printing; Self-Folding; Morphing; Shape-Changing Interface,,,
283,2019,Pinpoint: A PCB Debugging Pipeline Using Interruptible Routing and Instrumentation,ACM CHI,"Evan Strasnick, Sean Follmer, Maneesh Agrawala","Difficulties in accessing, isolating, and iterating on the components and connections of a printed circuit board (PCB) create unique challenges in PCB debugging. Manual probing methods are slow and error prone, and even dedicated PCB testing equipment remains limited by its inability to modify the circuit during testing. We present Pinpoint, a tool that facilitates in-circuit PCB debugging through techniques such as programmatically probing signals, dynamically disconnecting components and subcircuits to test in isolation, and splicing in new elements to explore potential modifications. Pinpoint automatically instruments a PCB design and generates designs for a physical jig board that interfaces the user's PCB to our custom testing hardware and to software tools. ",https://dl.acm.org/citation.cfm?doid=3290605.3300278,https://hcie.csail.mit.edu/fabpub/img/Pinpoint.png,Printed Circuit Board; PCB; Debugging; Design Tool; Jig; Incircuit Testing; Design-for-Test; Instrumentation,,,
284,2019,AutoFritz: Autocomplete for Prototyping Virtual Breadboard Circuits,ACM CHI,"Jo-Yu Lo, Da-Yuan Huang, Tzu-Sheng Kuo, Chen-Kuo Sun, Jun Gong, Teddy Seyed, Xing-Dong Yang, Bing-Yu Chen","We propose autocomplete for the design and development of virtual breadboard circuits using software prototyping tools. With our system, a user inserts a component into the virtual breadboard, and it automatically provides a user with a list of suggested components. These suggestions complete or extend the electronic functionality of the inserted component to save the user's time and reduce circuit error. To demonstrate the effectiveness of autocomplete, we implemented our system on Fritzing, a popular open source breadboard circuit prototyping software, used by novice makers. Our autocomplete suggestions were implemented based upon schematics from datasheets for standard components, as well as how components are used together from over 4000 circuit projects from the Fritzing community. ",https://dl.acm.org/citation.cfm?doid=3290605.3300633,https://hcie.csail.mit.edu/fabpub/img/AutoFritz.png,Circuit Design; Breadboard; Autocomplete,,,
285,2019,VirtualComponent: A Mixed-Reality Tool for Designing and Tuning Breadboarded Circuits,ACM CHI,"Yoonji Kim, Youngkyung Choi, Hyein Lee, Geehyuk Lee, Andrea Bianchi","Prototyping electronic circuits is an increasingly popular activity, supported by researchers, who develop toolkits to improve the design, debugging, and fabrication of Electronics. Although past work mainly dealt with circuit topology, in this paper we propose a system for determining or tuning the values of the circuit components. Based on the results of a formative study with seventeen makers, we designed VirtualComponent, a mixed-reality tool that allows users to digitally place electronic components on a real breadboard, tune their values in software, and see these changes applied to the physical circuit in real-time.",https://dl.acm.org/citation.cfm?doid=3290605.3300407,https://hcie.csail.mit.edu/fabpub/img/VirtualComponent.png,Physical Computing; Circuits; Component Tuning; Toolkit,,,
286,2019,"ElectroDermis: Fully Untethered, Stretchable, and Highly-Customizable Electronic Bandages",ACM CHI,"Eric Markvicka, Guanyun Wang, Yi-Chin Lee, Gierad Laput, Carmel Majidi, Lining Yao","Wearables have emerged as an increasingly promising interactive platform, imbuing the human body with always-available computational capabilities. This unlocks a wide range of applications, including discreet information access, health monitoring, fitness, and fashion. However, unlike previous platforms, wearable Electronics require structural conformity, must be comfortable for the wearer, and should be soft, elastic, and aesthetically appealing. We envision a future where Electronics can be temporarily attached to the body (like bandages or party masks), but in functional and aesthetically pleasing ways. Towards this vision, we introduce ElectroDermis, a fabrication approach that simplifies the creation of highly-functional and stretchable wearable Electronics that are conformal and fully untethered by discretizing rigid circuit boards into individual components.",https://dl.acm.org/citation.cfm?doid=3290605.3300862,https://hcie.csail.mit.edu/fabpub/img/ElectroDermis.png,On-Skin Devices; Wearable Electronics; Fabrication; Spandex,,,
287,2019,LASEC: Instant Fabrication of Stretchable Circuits Using a Laser Cutter,ACM CHI,"Daniel Groeger, Jürgen Steimle","This paper introduces LASEC, the first technique for instant do-it-yourself fabrication of circuits with custom stretchability on a conventional laser cutter and in a single pass. The approach is based on integrated cutting and ablation of a two-layer material using parametric design patterns. These patterns enable the designer to customize the desired stretchability of the circuit, to combine stretchable with non-stretchable areas, or to integrate areas of different stretchability. For adding circuits on such stretchable cut patterns, we contribute routing strategies and a real-time routing algorithm. An interactive design tool assists designers by automatically generating patterns and circuits from a high-level specification of the desired interface. The approach is compatible with off-the-shelf materials and can realize transparent interfaces. Several application examples demonstrate the versatility of the novel technique for applications in wearable computing, interactive textiles, and stretchable input devices.",https://dl.acm.org/citation.cfm?doid=3290605.3300929,https://hcie.csail.mit.edu/fabpub/img/LASEC.png,Fabrication; Stretchable Circuits; Rapid Prototyping; Laser Cutting; Laser Ablation,,,
288,2019,"./trilaterate: A Fabrication Pipeline to Design and 3D Print Hover-, Touch-, and Force-Sensitive Objects",ACM CHI,"Martin Schmitz, Martin Stitz, Florian Müller, Markus Funk, Max Mühlhäuser","Hover, touch, and force are promising input modalities that get increasingly integrated into screens and everyday objects. However, these interactions are often limited to flat surfaces and the integration of suitable sensors is time-consuming and costly. To alleviate these limitations, we contribute Trilaterate: A Fabrication pipeline to 3D print custom objects that detect the 3D position of a finger hovering, touching, or forcing them by combining multiple capacitance measurements via capacitive trilateration. Trilaterate places and routes actively-shielded sensors inside the object and operates on consumer-level 3D printers. We present technical evaluations and example applications that validate and demonstrate the wide applicability of Trilaterate.",https://dl.acm.org/citation.cfm?doid=3290605.3300684,https://hcie.csail.mit.edu/fabpub/img/trilaterate.png,3D Printing; Capacitive Sensing; Hover; Touch; Force,,,
289,2019,Kyub: A 3D Editor for Modeling Sturdy Laser-Cut Objects,ACM CHI,"Patrick Baudisch, Arthur Silber, Yannis Kommana, Milan Gruner, Ludwig Wall, Kevin Reuss, Lukas Heilmann, Robert Kovacs, Daniel Rechlitz, Thijs Roumen ","We present an interactive editing system for laser cutting called kyub. Kyub allows users to create models efficiently in 3D, which it then unfolds into the 2D plates laser cutters expect. Unlike earlier systems, such as FlatFitFab, kyub affords construction based on closed box structures, which allows users to turn very thin material, such as 4mm plywood, into objects capable of withstanding large forces, such as chairs users can actually sit on. To afford such sturdy construction, every kyub project begins with a simple finger-joint ""boxel""—a structure we found to be capable of withstanding over 500kg of load. Users then extend their model by attaching additional boxels. Boxels merge automatically, resulting in larger, yet equally strong structures. While the concept of stacking boxels allows kyub to offer the strong affordance and ease of use of a voxel-based editor, boxels are not confined to a grid and readily combine with kuyb's various geometry deformation tools.",https://dl.acm.org/citation.cfm?doid=3290605.3300796,https://hcie.csail.mit.edu/fabpub/img/Kyub.png,Personal Fabrication; Laser Cutting; Interactive Editing,,,
290,2019,Digital Fabrication of Soft Actuated Objects by Machine Knitting,ACM CHI,"Lea Albaugh, Scott Hudson, Lining Yao","With recent interest in shape-changing interfaces, material-driven design, wearable technologies, and soft robotics, digital fabrication of soft actuatable material is increasingly in demand. Much of this research focuses on elastomers or non-stretchy air bladders. Computationally-controlled machine knitting offers an alternative fabrication technology which can rapidly produce soft textile objects that have a very different character: breathable, lightweight, and pleasant to the touch. These machines are well established and optimized for the mass production of garments, but compared to other digital fabrication techniques such as CNC machining or 3D printing, they have received much less attention as general purpose fabrication devices. In this work, we explore new ways to employ machine knitting for the creation of actuated soft objects. We describe the basic operation of this type of machine, then show new techniques for knitting tendon-based actuation into objects.",https://dl.acm.org/citation.cfm?doid=3290605.3300414,https://hcie.csail.mit.edu/fabpub/img/Machine-Knitting.png,Soft Materials; Additive Manufacturing; Computational Crafts; Soft Actuator,,,
291,2019,Desktop Electrospinning: A Single Extruder 3D Printer for Producing Rigid Plastic and Electrospun Textiles,ACM CHI,"Michael L. Rivera, Scott Hudson","We present a new type of 3D printer that combines rigid plastic printing with melt electrospinning– a technique that uses electrostatic forces to create thin fibers from a molten polymer. Our printer enables custom-shaped textile sheets (similar in feel to wool felt) to be produced alongside rigid plastic using a single material (i.e., PLA) in a single process. We contribute open-source firmware, hardware specifications, and printing parameters to achieve melt electrospinning. Our approach offers new opportunities for fabricating interactive objects and sensors that blend the flexibility, absorbency and softness of produced electrospun textiles with the structure and rigidity of hard plastic for actuation, sensing, and tactile experiences.",https://dl.acm.org/citation.cfm?doid=3290605.3300434,https://hcie.csail.mit.edu/fabpub/img/Desktop-Electrospinning.png,3D Printing; Melt Electrospinning; Soft Material Fabrication; Textiles,,,
